{
  "manifest_version": 1,
  "id": "example_tool",
  "category": "gui",
  "name": "示例 GUI 工具",
  "pro_shortcut": {"short_name": "示例工具"},
  "version": "1.0.0",
  "author": "作者",
  "description": "一个可由 WindyTranslator 启动的源码工具。",
  "runtime": "host_python",
  "entry": "entry.py",
  "working_directory": ".",
  "launch_options_label": "启动方式",
  "launch_options": [
    {
      "id": "project",
      "name": "当前游戏目录",
      "arguments": [
        {"name": "project", "flag": "--initial-project", "type": "game_path", "required": true}
      ]
    }
  ]
}
